<?xml version="1.0" encoding="UTF-8"?>
<!DOCTYPE webflow PUBLIC "-//SPRING//DTD WEBFLOW//EN"
	"http://www.springframework.org/dtd/spring-webflow.dtd">

<webflow id="sellItem" start-state="enterPriceAndItemCount">

	<view-state id="enterPriceAndItemCount" view="/priceAndItemCountForm">
		<transition on="submit" to="anotherEnterPriceAndItemCount">
			<action bean="sellItemAction" />
		</transition>
	</view-state>
	
	<view-state id="anotherEnterPriceAndItemCount" view="/anotherPriceAndItemCountForm">
		<transition on="submit" to="enterCategory">
			<action bean="sellItemAction" />
		</transition>
	</view-state>
	
	<!--  everything from here on still needs to be converted! -->
	
	<view-state id="enterCategory" view="categoryForm">
		<transition on="submit" to="requiresShipping">
			<action bean="sellItemAction" method="bindAndValidate"/>
		</transition>
	</view-state>

	<decision-state id="requiresShipping">
		<if test="${flowScope.sale.shipping}" then="enterShippingDetails" else="showCostOverview"/>
	</decision-state>

	<view-state id="enterShippingDetails" view="shippingDetailsForm">
		<transition on="submit" to="showCostOverview">
			<action bean="sellItemAction" method="bindAndValidate"/>
		</transition>
	</view-state>

	<end-state id="showCostOverview" view="costOverview"/>

</webflow>