<?xml version="1.0" encoding="UTF-8"?>

<!DOCTYPE webflow PUBLIC "-//SPRING//DTD WEBFLOW//EN"
	"http://www.springframework.org/dtd/spring-webflow.dtd">

<webflow id="person.Search" start-state="criteria.view">

	<view-state id="criteria.view" view="person.Search.criteria.view">
		<transition on="submit" to="executeQuery">
			<action bean="person.Search.formAction" method="bindAndValidate"/>
		</transition>
	</view-state>

	<action-state id="executeQuery">
		<action bean="person.Search.executeQuery"/>
		<transition on="success" to="results.view"/>
	</action-state>
	
	<view-state id="results.view" view="person.Search.results.view">
		<transition on="newSearch" to="criteria.view"/>
		<transition on="select" to="personId.set"/>
	</view-state>

	<action-state id="personId.set">
		<action bean="person.Search.id.set"/>
		<transition on="success" to="person.Detail"/>
		<transition on="error" to="error"/>
	</action-state>
	
	<subflow-state id="person.Detail" flow="person.Detail">
		<attribute-mapper bean="id.attributeMapper"/>
		<transition on="finish" to="executeQuery"/>
		<transition on="error" to="error"/>
	</subflow-state>
	
	<end-state id="error" view="error.view"/>
	
</webflow>